{
  "extractor_version": "fidelity-extractor-v1+Berlin-2026-07-15",
  "slot_index": 2,
  "occurrences": [
    {
      "id": {
        "node_preorder": 30,
        "start": 0,
        "end": 8
      },
      "pattern_id": "temp-number-degree-v1",
      "namespace": "temperature",
      "merged_categories": [
        "temperature"
      ],
      "voided": false,
      "voided_reason": null
    },
    {
      "id": {
        "node_preorder": 30,
        "start": 11,
        "end": 19
      },
      "pattern_id": "temp-number-degree-v1",
      "namespace": "temperature",
      "merged_categories": [
        "temperature"
      ],
      "voided": false,
      "voided_reason": null
    },
    {
      "id": {
        "node_preorder": 42,
        "start": 0,
        "end": 3
      },
      "pattern_id": "temp-number-degree-v1",
      "namespace": "temperature",
      "merged_categories": [
        "temperature"
      ],
      "voided": false,
      "voided_reason": null
    },
    {
      "id": {
        "node_preorder": 45,
        "start": 0,
        "end": 3
      },
      "pattern_id": "temp-number-degree-v1",
      "namespace": "temperature",
      "merged_categories": [
        "temperature"
      ],
      "voided": false,
      "voided_reason": null
    }
  ],
  "arbitration": {
    "considered": [
      {
        "node_preorder": 30,
        "start": 0,
        "length": 8,
        "pattern_id": "temp-number-degree-v1",
        "selected": true
      },
      {
        "node_preorder": 30,
        "start": 11,
        "length": 8,
        "pattern_id": "temp-number-degree-v1",
        "selected": true
      },
      {
        "node_preorder": 42,
        "start": 0,
        "length": 3,
        "pattern_id": "temp-number-degree-v1",
        "selected": true
      },
      {
        "node_preorder": 45,
        "start": 0,
        "length": 3,
        "pattern_id": "temp-number-degree-v1",
        "selected": true
      }
    ]
  },
  "salience": {
    "f_max": 64.0,
    "candidates": [
      {
        "occurrence_id": {
          "node_preorder": 30,
          "start": 0,
          "end": 8
        },
        "font_size": 12.0,
        "salience_ratio": 0.8125,
        "in_E": false
      },
      {
        "occurrence_id": {
          "node_preorder": 30,
          "start": 11,
          "end": 19
        },
        "font_size": 12.0,
        "salience_ratio": 0.8125,
        "in_E": false
      },
      {
        "occurrence_id": {
          "node_preorder": 42,
          "start": 0,
          "end": 3
        },
        "font_size": 64.0,
        "salience_ratio": 0.0,
        "in_E": true
      },
      {
        "occurrence_id": {
          "node_preorder": 45,
          "start": 0,
          "end": 3
        },
        "font_size": 28.0,
        "salience_ratio": 0.5625,
        "in_E": false
      }
    ],
    "E": [
      {
        "node_preorder": 42,
        "start": 0,
        "end": 3
      }
    ]
  },
  "max_min_binding": {
    "branch": "no-label",
    "distances": [],
    "max": {
      "label_id": null,
      "temp_id": {
        "node_preorder": 42,
        "start": 0,
        "end": 3
      },
      "canonical_id": null,
      "value": "25",
      "display_decimals": 0
    },
    "min": {
      "label_id": null,
      "temp_id": {
        "node_preorder": 42,
        "start": 0,
        "end": 3
      },
      "canonical_id": null,
      "value": "25",
      "display_decimals": 0
    },
    "canonical_published": false,
    "decision_path": [
      {
        "code": "branch-no-label",
        "detail": null
      },
      {
        "code": "no-label-numeric-bound",
        "detail": "max=(42, 0, 3) min=(42, 0, 3)"
      },
      {
        "code": "equal-value-ambiguous",
        "detail": null
      },
      {
        "code": "canonical-published",
        "detail": "false"
      }
    ]
  },
  "hourly_binding": {
    "pretriage": "canonical-incomplete-ambiguous",
    "has_label": null,
    "candidates": [],
    "label_parse": [],
    "bindings": [],
    "signature": [],
    "decision_path": [
      {
        "code": "hourly-pretriage",
        "detail": "daily canonical not fully published"
      }
    ]
  },
  "field_paths": {
    "name": {
      "state": "match",
      "decision_path": [
        {
          "code": "name-substring-hit",
          "detail": "node=24"
        }
      ]
    },
    "date": {
      "state": "match",
      "decision_path": [
        {
          "code": "date-hit",
          "detail": "2026-07-15"
        }
      ]
    },
    "condition": {
      "state": "match",
      "decision_path": [
        {
          "code": "condition-wmo-hit",
          "detail": "node=51"
        }
      ]
    },
    "max": {
      "state": "ambiguous",
      "decision_path": [
        {
          "code": "branch-no-label",
          "detail": null
        },
        {
          "code": "no-label-numeric-bound",
          "detail": "max=(42, 0, 3) min=(42, 0, 3)"
        },
        {
          "code": "equal-value-ambiguous",
          "detail": null
        },
        {
          "code": "canonical-published",
          "detail": "false"
        }
      ]
    },
    "min": {
      "state": "ambiguous",
      "decision_path": [
        {
          "code": "branch-no-label",
          "detail": null
        },
        {
          "code": "no-label-numeric-bound",
          "detail": "max=(42, 0, 3) min=(42, 0, 3)"
        },
        {
          "code": "equal-value-ambiguous",
          "detail": null
        },
        {
          "code": "canonical-published",
          "detail": "false"
        }
      ]
    },
    "hourly": {
      "state": "ambiguous",
      "decision_path": [
        {
          "code": "hourly-pretriage",
          "detail": "daily canonical not fully published"
        }
      ]
    }
  },
  "text_model": [
    {
      "node_preorder": 20,
      "text_coord_base": 0,
      "codepoint_length": 0
    },
    {
      "node_preorder": 22,
      "text_coord_base": 0,
      "codepoint_length": 0
    },
    {
      "node_preorder": 24,
      "text_coord_base": 0,
      "codepoint_length": 6
    },
    {
      "node_preorder": 25,
      "text_coord_base": 6,
      "codepoint_length": 0
    },
    {
      "node_preorder": 27,
      "text_coord_base": 6,
      "codepoint_length": 24
    },
    {
      "node_preorder": 28,
      "text_coord_base": 30,
      "codepoint_length": 0
    },
    {
      "node_preorder": 30,
      "text_coord_base": 30,
      "codepoint_length": 20
    },
    {
      "node_preorder": 31,
      "text_coord_base": 50,
      "codepoint_length": 0
    },
    {
      "node_preorder": 32,
      "text_coord_base": 50,
      "codepoint_length": 0
    },
    {
      "node_preorder": 34,
      "text_coord_base": 50,
      "codepoint_length": 2
    },
    {
      "node_preorder": 36,
      "text_coord_base": 52,
      "codepoint_length": 0
    },
    {
      "node_preorder": 38,
      "text_coord_base": 52,
      "codepoint_length": 0
    },
    {
      "node_preorder": 40,
      "text_coord_base": 52,
      "codepoint_length": 0
    },
    {
      "node_preorder": 42,
      "text_coord_base": 52,
      "codepoint_length": 3
    },
    {
      "node_preorder": 43,
      "text_coord_base": 55,
      "codepoint_length": 0
    },
    {
      "node_preorder": 45,
      "text_coord_base": 55,
      "codepoint_length": 3
    },
    {
      "node_preorder": 46,
      "text_coord_base": 58,
      "codepoint_length": 0
    },
    {
      "node_preorder": 47,
      "text_coord_base": 58,
      "codepoint_length": 0
    },
    {
      "node_preorder": 50,
      "text_coord_base": 58,
      "codepoint_length": 2
    },
    {
      "node_preorder": 51,
      "text_coord_base": 60,
      "codepoint_length": 13
    },
    {
      "node_preorder": 52,
      "text_coord_base": 73,
      "codepoint_length": 0
    },
    {
      "node_preorder": 54,
      "text_coord_base": 73,
      "codepoint_length": 0
    },
    {
      "node_preorder": 56,
      "text_coord_base": 73,
      "codepoint_length": 18
    },
    {
      "node_preorder": 57,
      "text_coord_base": 91,
      "codepoint_length": 0
    }
  ]
}
