{
  "extractor_version": "fidelity-extractor-v1+Berlin-2026-07-15",
  "slot_index": 1,
  "occurrences": [
    {
      "id": {
        "node_preorder": 52,
        "start": 0,
        "end": 3
      },
      "pattern_id": "temp-number-degree-v1",
      "namespace": "temperature",
      "merged_categories": [
        "temperature"
      ],
      "voided": false,
      "voided_reason": null
    },
    {
      "id": {
        "node_preorder": 55,
        "start": 0,
        "end": 3
      },
      "pattern_id": "min-label-v1",
      "namespace": "min-label",
      "merged_categories": [
        "min"
      ],
      "voided": false,
      "voided_reason": null
    },
    {
      "id": {
        "node_preorder": 55,
        "start": 4,
        "end": 7
      },
      "pattern_id": "temp-number-degree-v1",
      "namespace": "temperature",
      "merged_categories": [
        "temperature"
      ],
      "voided": false,
      "voided_reason": null
    }
  ],
  "arbitration": {
    "considered": [
      {
        "node_preorder": 52,
        "start": 0,
        "length": 3,
        "pattern_id": "temp-number-degree-v1",
        "selected": true
      },
      {
        "node_preorder": 55,
        "start": 0,
        "length": 3,
        "pattern_id": "min-label-v1",
        "selected": true
      },
      {
        "node_preorder": 55,
        "start": 4,
        "length": 3,
        "pattern_id": "temp-number-degree-v1",
        "selected": true
      }
    ]
  },
  "salience": {
    "f_max": 140.0,
    "candidates": [
      {
        "occurrence_id": {
          "node_preorder": 52,
          "start": 0,
          "end": 3
        },
        "font_size": 140.0,
        "salience_ratio": 0.0,
        "in_E": true
      },
      {
        "occurrence_id": {
          "node_preorder": 55,
          "start": 4,
          "end": 7
        },
        "font_size": 40.0,
        "salience_ratio": 0.7142857142857143,
        "in_E": false
      }
    ],
    "E": [
      {
        "node_preorder": 52,
        "start": 0,
        "end": 3
      }
    ]
  },
  "max_min_binding": {
    "branch": "single-label",
    "distances": [
      {
        "label_id": {
          "node_preorder": 55,
          "start": 0,
          "end": 3
        },
        "temp_id": {
          "node_preorder": 52,
          "start": 0,
          "end": 3
        },
        "dom_edges": 2,
        "text_coord_diff": 3
      }
    ],
    "max": {
      "label_id": null,
      "temp_id": null,
      "canonical_id": null,
      "value": null,
      "display_decimals": null
    },
    "min": {
      "label_id": {
        "node_preorder": 55,
        "start": 0,
        "end": 3
      },
      "temp_id": {
        "node_preorder": 52,
        "start": 0,
        "end": 3
      },
      "canonical_id": {
        "node_preorder": 52,
        "start": 0,
        "end": 3
      },
      "value": "25",
      "display_decimals": 0
    },
    "canonical_published": false,
    "decision_path": [
      {
        "code": "branch-single-label",
        "detail": "min"
      },
      {
        "code": "single-label-no-remaining-ambiguous",
        "detail": null
      },
      {
        "code": "canonical-published",
        "detail": "false"
      }
    ]
  },
  "hourly_binding": {
    "pretriage": "canonical-incomplete-ambiguous",
    "has_label": null,
    "candidates": [],
    "label_parse": [],
    "bindings": [],
    "signature": [],
    "decision_path": [
      {
        "code": "hourly-pretriage",
        "detail": "daily canonical not fully published"
      }
    ]
  },
  "field_paths": {
    "name": {
      "state": "match",
      "decision_path": [
        {
          "code": "name-substring-hit",
          "detail": "node=29"
        }
      ]
    },
    "date": {
      "state": "match",
      "decision_path": [
        {
          "code": "date-hit",
          "detail": "2026-07-15"
        }
      ]
    },
    "condition": {
      "state": "match",
      "decision_path": [
        {
          "code": "condition-wmo-hit",
          "detail": "node=45"
        }
      ]
    },
    "max": {
      "state": "ambiguous",
      "decision_path": [
        {
          "code": "branch-single-label",
          "detail": "min"
        },
        {
          "code": "single-label-no-remaining-ambiguous",
          "detail": null
        },
        {
          "code": "canonical-published",
          "detail": "false"
        }
      ]
    },
    "min": {
      "state": "mismatch",
      "decision_path": [
        {
          "code": "branch-single-label",
          "detail": "min"
        },
        {
          "code": "single-label-no-remaining-ambiguous",
          "detail": null
        },
        {
          "code": "canonical-published",
          "detail": "false"
        }
      ]
    },
    "hourly": {
      "state": "ambiguous",
      "decision_path": [
        {
          "code": "hourly-pretriage",
          "detail": "daily canonical not fully published"
        }
      ]
    }
  },
  "text_model": [
    {
      "node_preorder": 23,
      "text_coord_base": 0,
      "codepoint_length": 0
    },
    {
      "node_preorder": 25,
      "text_coord_base": 0,
      "codepoint_length": 0
    },
    {
      "node_preorder": 27,
      "text_coord_base": 0,
      "codepoint_length": 0
    },
    {
      "node_preorder": 29,
      "text_coord_base": 0,
      "codepoint_length": 6
    },
    {
      "node_preorder": 30,
      "text_coord_base": 6,
      "codepoint_length": 0
    },
    {
      "node_preorder": 32,
      "text_coord_base": 6,
      "codepoint_length": 24
    },
    {
      "node_preorder": 33,
      "text_coord_base": 30,
      "codepoint_length": 0
    },
    {
      "node_preorder": 34,
      "text_coord_base": 30,
      "codepoint_length": 0
    },
    {
      "node_preorder": 36,
      "text_coord_base": 30,
      "codepoint_length": 0
    },
    {
      "node_preorder": 43,
      "text_coord_base": 30,
      "codepoint_length": 0
    },
    {
      "node_preorder": 45,
      "text_coord_base": 30,
      "codepoint_length": 7
    },
    {
      "node_preorder": 46,
      "text_coord_base": 37,
      "codepoint_length": 0
    },
    {
      "node_preorder": 47,
      "text_coord_base": 37,
      "codepoint_length": 0
    },
    {
      "node_preorder": 48,
      "text_coord_base": 37,
      "codepoint_length": 0
    },
    {
      "node_preorder": 50,
      "text_coord_base": 37,
      "codepoint_length": 0
    },
    {
      "node_preorder": 52,
      "text_coord_base": 37,
      "codepoint_length": 3
    },
    {
      "node_preorder": 53,
      "text_coord_base": 40,
      "codepoint_length": 0
    },
    {
      "node_preorder": 55,
      "text_coord_base": 40,
      "codepoint_length": 7
    },
    {
      "node_preorder": 56,
      "text_coord_base": 47,
      "codepoint_length": 0
    },
    {
      "node_preorder": 57,
      "text_coord_base": 47,
      "codepoint_length": 0
    },
    {
      "node_preorder": 59,
      "text_coord_base": 47,
      "codepoint_length": 0
    },
    {
      "node_preorder": 61,
      "text_coord_base": 47,
      "codepoint_length": 18
    },
    {
      "node_preorder": 62,
      "text_coord_base": 65,
      "codepoint_length": 0
    },
    {
      "node_preorder": 64,
      "text_coord_base": 65,
      "codepoint_length": 0
    },
    {
      "node_preorder": 66,
      "text_coord_base": 65,
      "codepoint_length": 0
    },
    {
      "node_preorder": 67,
      "text_coord_base": 65,
      "codepoint_length": 0
    },
    {
      "node_preorder": 68,
      "text_coord_base": 65,
      "codepoint_length": 0
    },
    {
      "node_preorder": 72,
      "text_coord_base": 65,
      "codepoint_length": 0
    },
    {
      "node_preorder": 74,
      "text_coord_base": 65,
      "codepoint_length": 0
    },
    {
      "node_preorder": 76,
      "text_coord_base": 65,
      "codepoint_length": 0
    },
    {
      "node_preorder": 78,
      "text_coord_base": 65,
      "codepoint_length": 0
    },
    {
      "node_preorder": 80,
      "text_coord_base": 65,
      "codepoint_length": 0
    },
    {
      "node_preorder": 82,
      "text_coord_base": 65,
      "codepoint_length": 0
    },
    {
      "node_preorder": 84,
      "text_coord_base": 65,
      "codepoint_length": 0
    },
    {
      "node_preorder": 86,
      "text_coord_base": 65,
      "codepoint_length": 0
    },
    {
      "node_preorder": 88,
      "text_coord_base": 65,
      "codepoint_length": 0
    },
    {
      "node_preorder": 91,
      "text_coord_base": 65,
      "codepoint_length": 13
    },
    {
      "node_preorder": 94,
      "text_coord_base": 78,
      "codepoint_length": 35
    },
    {
      "node_preorder": 96,
      "text_coord_base": 113,
      "codepoint_length": 0
    },
    {
      "node_preorder": 100,
      "text_coord_base": 113,
      "codepoint_length": 0
    },
    {
      "node_preorder": 102,
      "text_coord_base": 113,
      "codepoint_length": 0
    },
    {
      "node_preorder": 104,
      "text_coord_base": 113,
      "codepoint_length": 0
    },
    {
      "node_preorder": 106,
      "text_coord_base": 113,
      "codepoint_length": 0
    },
    {
      "node_preorder": 109,
      "text_coord_base": 113,
      "codepoint_length": 22
    },
    {
      "node_preorder": 112,
      "text_coord_base": 135,
      "codepoint_length": 55
    },
    {
      "node_preorder": 114,
      "text_coord_base": 190,
      "codepoint_length": 0
    }
  ]
}
